{
  "apiVersion": "nexa.dev/source-bundle/v1",
  "kind": "SourceBundle",
  "identity": {
    "providerId": "job-service",
    "modulePath": "github.com/nxnminieye/nexa",
    "packagePath": "github.com/nxnminieye/nexa/plugins/service/job",
    "version": "v0.1.0"
  },
  "files": [
    {"path": "backend/job/desc/job.proto", "size": 462, "digest": "sha256:ebd3a0b158034830661dff0d3fa678f5f4e6f1d0db2e095beeb1366240dd1e30", "mode": "0644"},
    {"path": "backend/job/ent/schema/lease.go", "size": 1269, "digest": "sha256:7343faadb8592d5d35682bec9baffe907e1f13032590eb7a84489070807f7869", "mode": "0644"},
    {"path": "backend/job/ent/schema/run.go", "size": 2991, "digest": "sha256:8b111c4ce565e69e5cb06ed6b42fe478565ce0df2be43f0d3adbf692520aa102", "mode": "0644"},
    {"path": "backend/job/ent/schema/schedule.go", "size": 1771, "digest": "sha256:4fd5d9d7d520eb18609d6a5cbcc429e7484d7633bf705a39f854c5e2f941f0a8", "mode": "0644"},
    {"path": "backend/job/jobapp/error.go", "size": 1003, "digest": "sha256:5ff92bc6bdd78091f7b2ec52f95e2ff51df5978cd267f4b50ac5ff9a545add60", "mode": "0644"},
    {"path": "backend/job/jobapp/health.go", "size": 895, "digest": "sha256:e848df6d8b61910be4b4b017c6ea5fdf4d0572168b291bb7a03ff6610fc0d97c", "mode": "0644"},
    {"path": "backend/job/jobapp/jobapp_test.go", "size": 11464, "digest": "sha256:0c471ff0caa136208b47b6f9357274b0cfecdf04ff77aa17eb20f236f650b4af", "mode": "0644"},
    {"path": "backend/job/jobapp/registry.go", "size": 1563, "digest": "sha256:7aed8a132d1107979d105bc6ad6421f97779889f4ca842c8ff4e719ed98aa4c3", "mode": "0644"},
    {"path": "backend/job/jobapp/retention.go", "size": 1048, "digest": "sha256:88ffa8f9e8e5c4d0b61341084382f189ea1b7cb34b320e3d05903355148c68ba", "mode": "0644"},
    {"path": "backend/job/jobapp/run.go", "size": 3898, "digest": "sha256:a1ee6684c15921de4dc6486cf0166e708e1c5dc518842c155ce9b5388008edb7", "mode": "0644"},
    {"path": "backend/job/jobapp/scheduler.go", "size": 5577, "digest": "sha256:005b73bfda1f47aa02374b4e5d98e8f95629180649665de230c993b3f5781048", "mode": "0644"},
    {"path": "backend/job/jobapp/task.go", "size": 250, "digest": "sha256:51e77562007c25edca8267f0a3f64622c4cada5855b8dc84e61f4a1070edd1d7", "mode": "0644"},
    {"path": "backend/job/migrations/0001_job.sql", "size": 843, "digest": "sha256:a519a59c709a15e5bfa832e8d005b3a68bcb01e64bf7f7d226a7aadb5468e672", "mode": "0644"}
  ],
  "profiles": [
    {
      "id": "backend",
      "files": [
        "backend/job/desc/job.proto",
        "backend/job/ent/schema/lease.go",
        "backend/job/ent/schema/run.go",
        "backend/job/ent/schema/schedule.go",
        "backend/job/jobapp/error.go",
        "backend/job/jobapp/health.go",
        "backend/job/jobapp/jobapp_test.go",
        "backend/job/jobapp/registry.go",
        "backend/job/jobapp/retention.go",
        "backend/job/jobapp/run.go",
        "backend/job/jobapp/scheduler.go",
        "backend/job/jobapp/task.go",
        "backend/job/migrations/0001_job.sql"
      ],
      "requiresProfiles": [],
      "requiresBundles": [],
      "validations": [
        {"id": "job-kernel", "kind": "go-test", "workingDirectory": "backend/job", "packages": ["./jobapp"]}
      ]
    }
  ]
}
